{
  "$schema": "./run_manifest.schema.json",
  "manifest_version": "1.0.0",
  "generated_at": "2026-04-30T21:39:11+00:00",
  "application": {
    "name": "Digital org desk",
    "version": "0.1.0",
    "repository": "file:///Users/kylejonespatricia/Downloads/files"
  },
  "data_sources": [
    {
      "kind": "parquet",
      "uri": "file:///Users/kylejonespatricia/Documents/email/emails.parquet",
      "description": "Email table (file + message columns)",
      "role_in_learning": "primary_corpus",
      "record_count": 275203
    },
    {
      "kind": "maildir",
      "uri": "file:///Users/kylejonespatricia/Documents/email/maildir",
      "description": "On-disk messages referenced by parquet paths",
      "role_in_learning": "evidence_paths"
    }
  ],
  "agents_used": [
    {
      "role_id": "trader",
      "agent_name": "Morgan",
      "registry_paths": {
        "skill_path": "roles/trader/SKILL.md",
        "agent_path": "roles/trader/AGENT.md"
      },
      "participation": "behavioral_template"
    },
    {
      "role_id": "risk_analyst",
      "agent_name": "Claire",
      "registry_paths": {
        "skill_path": "roles/risk_analyst/SKILL.md",
        "agent_path": "roles/risk_analyst/AGENT.md"
      },
      "participation": "behavioral_template"
    },
    {
      "role_id": "scheduler",
      "agent_name": "Henry",
      "registry_paths": {
        "skill_path": "roles/scheduler/SKILL.md",
        "agent_path": "roles/scheduler/AGENT.md"
      },
      "participation": "behavioral_template"
    },
    {
      "role_id": "legal",
      "agent_name": "Anne",
      "registry_paths": {
        "skill_path": "roles/legal/SKILL.md",
        "agent_path": "roles/legal/AGENT.md"
      },
      "participation": "behavioral_template"
    },
    {
      "role_id": "accounting",
      "agent_name": "Paul",
      "registry_paths": {
        "skill_path": "roles/accounting/SKILL.md",
        "agent_path": "roles/accounting/AGENT.md"
      },
      "participation": "behavioral_template"
    },
    {
      "role_id": "ops",
      "agent_name": "Sam",
      "registry_paths": {
        "skill_path": "roles/ops/SKILL.md",
        "agent_path": "roles/ops/AGENT.md"
      },
      "participation": "behavioral_template"
    },
    {
      "role_id": "desk_manager",
      "agent_name": "Diane",
      "registry_paths": {
        "skill_path": "roles/desk_manager/SKILL.md",
        "agent_path": "roles/desk_manager/AGENT.md"
      },
      "participation": "behavioral_template"
    }
  ],
  "workflow_types_observed": [],
  "learning_outputs": [
    {
      "kind": "report",
      "uri": "file:///Users/kylejonespatricia/Downloads/files/learning/ATTESTATION.md",
      "description": "How to describe data + agent + skill lineage in product copy"
    }
  ],
  "skills_learned_or_updated": [],
  "method_summary": "Corpus-backed task inference (scripts/enron_infer_tasks.py) and/or LLM synthesis (PROMPT_TEMPLATES.md) over registry agents; human review before treating outputs as production skills.",
  "public_claims": [
    "This application used the data listed under data_sources and the agent definitions listed under agents_used in learning/last_run_manifest.json to drive skill learning from that data.",
    "When a run produces concrete SKILL updates, they are recorded under skills_learned_or_updated with versions and optional task id samples."
  ]
}
